{
  "schema_version": "as1-alert-envelope-v1",
  "satellite_id": "AS1",
  "platform": "tradingview",
  "layout_id": "maat",
  "observer": "maat-stopwatch-validator",
  "code_version": "1.0.0",
  "ticker_id": "BINANCE:BTCUSDT",
  "symbol": "BTCUSDT",
  "timeframe": "15",
  "bar_open_time": "2026-07-27T00:00:00Z",
  "bar_close_time": "2026-07-27T00:15:00Z",
  "sent_at": "2026-07-27T00:15:01Z",
  "packet_type": "bar_close_snapshot",
  "confirmed": true,
  "quality": "normal",
  "dedup_key": "maat|BINANCE:BTCUSDT|15|2026-07-27T00:15:00Z|as1-alert-envelope-v1",
  "payload": {
    "stopwatch_state": "ready",
    "validator_passed": true,
    "heru_365_signal": "neutral"
  }
}
